64,Development,"['COLLABORATIVE RESEARCH, DEVELOPMENT AND COMMERCIALIZATION AGREEMENT']","['Revolution Medicines, Inc.', 'Sanofi and RevMed are referred to in this Agreement individually as a ""Party"" and collectively as the ""Parties.""', 'RevMed', 'Aventis, Inc.', 'Sanofi']","['June 8, 2018']","['June 8, 2018']","['The term of this Agreement shall commence upon the Effective Date and, unless earlier terminated pursuant to this Article XII, shall continue in full force and effect until the expiration of Sanofi\'s payment obligations under Article IX or the Profit/Loss Share Agreement, whichever is later (the ""Term"").']",[],International Law,,,"['If Sanofi provides a Notice of Interest to RevMed within [***], then (i) RevMed shall, upon request of Sanofi, provide Sanofi with reasonable access to all other then-existing Know-How in RevMed\'s Control that exists in either paper or electronic form and pertains to the relevant SHP1-SHP2 Dual Inhibitor and (ii) the Parties shall negotiate exclusively in good faith and on a commercially reasonable basis the terms of a definitive agreement under which Sanofi would be granted SHP1-SHP2 Dual Inhibitor License Rights for [***] after RevMed receives such Notice of Interest (such period, the ""SHP1-SHP2 Dual Inhibitor Licensing Negotiation Period', 'Subject to the terms and conditions of this Agreement, RevMed hereby grants to Sanofi an exclusive (even as to RevMed and its Affiliates), royalty-bearing license (which shall be sub-licensable solely as provided in Section 3.4) under the RevMed Licensed Technology, to Research, Develop, Manufacture, use, sell, offer for sale, import and otherwise Commercialize and exploit Products (including, for clarity, any Companion Diagnostics with respect to such Products) in the Field in the Licensed Territory.', 'Subject to the terms and conditions of this Agreement, RevMed hereby grants to Sanofi an exclusive option, under the Patent Rights and Know-How claiming or embodied in the [***].']","['RevMed shall pay Sanofi such royalties until the earlier of (x) expiration of the Post-Termination Royalty Term therefor and (y) a Change of Control of Sanofi.', 'Upon any termination of this Agreement, RevMed shall pay to Sanofi any amounts owed to Third Parties under license agreements to which Sanofi is a party that grant Sanofi a license under such Third Party\'s Patent Rights or Know-How that is sublicensed to RevMed pursuant to Section 12.3(c)(ii)A, unless RevMed declines in writing to obtain such sublicense. ""Post-Termination Royalty Term"" means: (I) with respect to a particular country and a particular Termination Product that is the subject of the royalty obligations under Section 12.3(c)(ii)B(1), the period of time commencing upon the First Commercial Sale of such Termination Product in such country (by RevMed or its Affiliates or sublicensees) and ending upon the latest of (a) the date on which there is no Valid Claim (as such term is applied mutatis mutandis to Sanofi Sole Program Patents) of a Sanofi Sole Program Patent that would be infringed by the sale of such Termination Product in such country; (b) the expiration of any Regulatory Exclusivity granted with respect to such Termination Product in such country[***] and (II) with respect to a particular country and a particular Termination Product that is subject of the royalty obligations under Section 12.3(c)(ii)B(2) or Section 12.3(c)(ii)B(3), the period of time commencing upon the First Commercial Sale of such Termination Product in such country (by RevMed or its Affiliates or sublicensees) and ending upon the latest of (a) the expiration of any Regulatory Exclusivity granted with respect to such Termination Product in such country; and (b) [***].', 'Within [***] of the effective date of such termination (or as promptly as practical thereafter, if such period is not practical under Applicable Law), [***], Sanofi shall transfer and assign to RevMed all Regulatory Approvals relating to Termination Products, and, to the extent not previously provided to RevMed, transfer other Regulatory Materials including data from preclinical, non-clinical and clinical studies conducted by or on behalf of Sanofi, its Affiliates or Sublicensees on any Termination Products and all pharmacovigilance data (including all adverse event databases) on any Termination Products.', 'At the end of the sell-off period set forth in Section 12.3(c)(iii), Sanofi shall transfer to RevMed any and all inventory of SHP2 Inhibitors and Termination Products (including all research materials, final product, bulk drug substance, intermediates, work-in-process, formulation materials, reference standards, drug product clinical reserve samples, packaged retention samples, and the like) then in the possession of Sanofi, its Affiliates or Sublicensees, and continue or have continued any ongoing stability studies pertaining to any materials so transferred to RevMed for a reasonable period of time until RevMed can assume responsibility for such activities', ""If at the time of such termination, Sanofi or its Affiliates are Commercializing a particular Termination Product, then, at RevMed's request, the Parties shall negotiate in good faith a transition services agreement to cover detailing and promotion of such Termination Product (in the same manner and no more extensive than the then-current detailing and promotional efforts of Sanofi) by Sanofi or its Affiliate or contract sales force pursuant to a transition plan agreed by the Parties for a period not to exceed [***], and RevMed shall pay Sanofi a commercially reasonable amount to conduct such activities (which amount would include a commercially reasonable per-detail rate)."", ""Sanofi shall, at RevMed's request, for a period not to exceed [***] following the effective date of termination, provide reasonable technical assistance up to a total of [***] and, to the extent not already provided to RevMed, transfer copies of (including when available, in electronic format) all Sanofi Sole Program Know-How to RevMed or its designee, including without limitation: [***], in each case to the extent such materials are exclusively related to the Termination Product."", 'Within [***] after the effective date of such termination for Termination Products for which Regulatory Approval has been obtained prior to the effective date of such termination or [***] for other Termination Products (or as promptly as practical thereafter, if such period is not practical under Applicable Law), Sanofi shall transfer and assign to RevMed all Regulatory Approvals relating to such Termination Products, and, to the extent not previously provided to RevMed, transfer other Regulatory Materials including data from preclinical, non-clinical and clinical studies conducted by or on behalf of Sanofi, its Affiliates or Sublicensees on such Termination Products and all pharmacovigilance data (including all adverse event databases) on such Termination Products', 'Sanofi shall transfer and assign, and shall ensure that its Affiliates transfer and assign, to RevMed, at no cost to RevMed, all Product Marks exclusively relating to any Termination Product, provided that such Product Marks do not contain the business entity names of Sanofi or its Affiliates or variations thereof, except as may otherwise be required by Applicable Law during a transition period to avoid any interruptions in supply of Termination Product to patients. I', ""If at the time of such termination, Sanofi or its Affiliates are conducting any Clinical Trials (including Registrational Clinical Trials) of a Termination Product, then, at RevMed's election on a trial-by-trial basis, Sanofi shall cooperate, and shall ensure that its Affiliates cooperate, with RevMed to transfer the conduct of all such Clinical Trials to RevMed within [***] after the effective date of such transfer (to the extent practical in light of applicable regulatory and patient safety concerns) and RevMed shall assume any and all liability, and is liable, for such Clinical Trials conducted after the effective date of such termination (except to the extent Sanofi has an obligation of indemnification under Article XIV existing for a claim that arose prior to the effective date of such termination)."", ""In the case of a termination of this Agreement, Sanofi (with respect to the Termination Products in the Licensed Territory), shall be entitled, for a period of [***] after termination, to (i) complete Manufacture of work-in-progress, and (ii) continue conducting Commercialization activities being conducted by Sanofi hereunder as of such termination (if applicable, with respect to the terminated country(ies)), to the extent related to Termination Product in Sanofi's inventory as of such termination (or added to such inventory as a result of the completion described in clause (i)), provided that Sanofi fulfills its payment obligations under this Agreement in connection with such inventory sell-off, provided further that the payment of royalties to RevMed and the sharing of Net Profits and Net Losses under the Profit/Loss Share Agreement shall continue to apply during the sell-off period."", 'In addition to the foregoing, Sanofi shall use reasonable efforts with respect to those activities for which it is responsible hereunder to cooperate with RevMed to achieve an orderly transition of the Development, Manufacturing and Commercialization of Termination Products from Sanofi or its applicable Affiliate to RevMed.', 'Upon termination of [***] by Sanofi pursuant to Section 12.2(a)(ii)B (Termination by Sanofi for Change of Control) in the case of an Acquiror of RevMed that is a Major Biopharmaceutical Company, RevMed, [***], will (1) make available to Sanofi copies of [***], (2) provide Sanofi with copies of [***], (3) provide Sanofi with all [***], and (4) otherwise provide Sanofi all reasonable assistance in [***].', 'Each Party shall maintain complete, current and accurate records of all Development activities conducted by it hereunder, and all data and other information resulting from such activities, for at least [***] after the expiration or termination of this Agreement in its entirety or for such longer period as may be required by Applicable Law.', 'Furthermore, Sanofi shall within [***] after the effective date of such termination, transfer to RevMed all files and documents relating to the prosecution, defense or enforcement of the RevMed Licensed Patents or Joint Program Patents and provide reasonable assistance for a period not to exceed [***] following the effective date of termination, up to a total of [***], in the transfer of the prosecution, defense and enforcement responsibilities to RevMed, including by executing any documents reasonable necessary therefor.', ""At RevMed's reasonable request, for a period not to exceed [***] following the effective date of termination, Sanofi shall provide RevMed with assistance up to a total of [***] with any inquiries and correspondence with Regulatory Authorities relating to any such Termination Product."", 'With regard to Termination Products in countries for which the licenses to Sanofi are terminating, Sanofi shall provide the following transitional assistance, with costs allocated as set forth below', ""In the case of a termination of this Agreement, Sanofi (with respect to the Termination Products in the Licensed Territory), shall be entitled, for a period of [***] after termination, to (i) complete Manufacture of work-in-progress, and (ii) continue conducting Commercialization activities being conducted by Sanofi hereunder as of such termination (if applicable, with respect to the terminated country(ies)), to the extent related to such Termination Product in Sanofi's inventory as of such termination (or added to such inventory as a result of the completion described in clause (i)), provided that Sanofi fulfills its payment obligations under this Agreement in connection with such inventory sell-off, provided further that the sharing of Net Profits and Net Losses under the Profit/Loss Share Agreement shall continue to apply during the sell-off period."", 'If this Agreement is terminated in its entirety or with respect to one or more Products, other than by RevMed pursuant to Section 12.2(b) (Termination for Material Breach) or 12.2(c) (Termination for Insolvency), RevMed shall pay to Sanofi on a Product-by-Product basis royalties on sales of terminated Products (such Products, which for the purpose of clarity shall not include any Non-SHP2 Product, hereinafter referred to as ""Termination Products""), calculated based on worldwide Net Sales (as such term is applied mutatis mutandis to RevMed and including sales in the U.S.) by RevMed and its Affiliates and Sublicensees of such Termination Products as follows: [***].']",,[],,,RevolutionMedicinesInc_20200117_S-1_EX-10.1_11948417_EX-10.1_Development Agreement.pdf
65,Development,['DISTRIBUTION AND DEVELOPMENT AGREEMENT'],"['Sekisui', 'Qualigen, Inc. and its Affiliates', 'Qualigen', 'Sekisui Diagnostics, LLC and its Affiliates']","['May 1, 2016']",[],"['The initial term of this Agreement shall commence on the Effective Date and shall continue for a period of five (5) years unless earlier terminated pursuant to Section 14 hereof (the ""Term"").']",['The initial term of this Agreement and any renewal term thereof shall be automatically extended at the end of the initial term and any renewal term thereof for an additional one (1) year period unless either Party notifies the other Party not less than six (6) months before the end of the then in effect term of its intent to terminate this Agreement.'],International Law,,"'Civil Law' would be the most appropriate governing law for this agreement, considering that 'International Law' is too broad a category and this contract involves multiple parties from different jurisdictions. Moreover, specific contract, commercial, or consumer protection laws may be integrated within a civil law framework.","['Qualigen hereby appoints Sekisui, and Sekisui accepts the appointment to act on an exclusive basis pursuant to the terms and conditions of this Agreement, as a distributor for the sale of the Products in the Territory.', ""Qualigen shall supply Sekisui with all of Sekisui's commercial requirements for the Product in the Applicable Markets."", 'Sekisui shall purchase the Products exclusively from Qualigen, and Qualigen shall supply the Products exclusively to Sekisui, in each case for the Territory.']","['Upon the expiration or termination of the Term (other than in connection with a Sale Transaction in which Sekisui acquires Qualigen), Sekisui shall cooperate in permitting Qualigen to offer to rehire any Sekisui sales representatives who are primarily responsible for selling the Products. A sales person ""primarily responsible for selling the Products"" is one that spends more than half of his or her time and receives more than half of his or her commission based compensation based on sales of the Products.']",,['The initial term of this Agreement and any renewal term thereof shall be automatically extended at the end of the initial term and any renewal term thereof for an additional one (1) year period unless either Party notifies the other Party not less than six (6) months before the end of the then in effect term of its intent to terminate this Agreement'],,,RitterPharmaceuticalsInc_20200313_S-4A_EX-10.54_12055220_EX-10.54_Development Agreement.pdf
66,Development,['Mobile Application Development Agreement'],"['VAL', 'VGrab Asia Ltd.', 'Mr. Zheng Qing, Mr. Gu Xianwin and Ms. Chen Weijie']","['5th Day of March, 2019']",['This Agreement shall commence on 5th March 2019'],"['This Agreement commences on the date it is executed and shall continue until full performance by both parties, or until earlier terminated by one party under the terms of this Agreement.', 'This Agreement will be for the maximum period of six (6) months beginning for the commencement date, renewable in accordance with the terms hereof, unless earlier terminated pursuant to this Agreement.']",[],International Law,,International Law,[],[],"Yes, there is a discrepancy in the Expiration Date. The first statement indicates that the agreement continues until full performance or earlier termination, while the second statement sets a maximum period of six months, renewable unless earlier terminated. It would be beneficial to clarify which applies or how they coexist. The Renewal Term, Notice to terminate renewal, Exclusivity, and Post-Term",[],,,VgrabCommunicationsInc_20200129_10-K_EX-10.33_11958828_EX-10.33_Development Agreement.pdf
67,IP,['INTELLECTUAL PROPERTY AGREEMENT'],"['Armstrong Flooring, Inc.', 'Buyer', '""Licensing"" and together with Seller, ""Arizona"")', 'AHF Holding, Inc.', 'AFI Licensing LLC', 'Seller', 'formerly known as Tarzan HoldCo, Inc.)', 'Armstrong Hardwood Flooring Company', 'each of Arizona on the one hand and the Buyer Entities on the other hand, a ""Party"" and collectively, the ""Parties"").', '(the ""Company"" and together with Buyer the ""Buyer Entities""']","['December 31, 2018']","['December 31, 2018']","['Unless earlier terminated pursuant to the provisions hereof, the term of this Agreement and the licenses and other grants of rights (and related obligations) under this Agreement shall (i) with respect to the Arizona Licensed Trademarks, be for the Arizona Trademark License Term, (ii) with respect to the Diamond Licensed Trademarks, be for the Diamond Trademark License Term, (iii) with respect to the Phase- Out Marks, be for the term set forth in Section 6.6, and (iv) with respect to Copyrights, Know-How and Patents, be in perpetuity.']",[],International Law,,,[],[],,[],,,ArmstrongFlooringInc_20190107_8-K_EX-10.2_11471795_EX-10.2_Intellectual Property Agreement.pdf
68,Endorsement,['ENDORSEMENT AGREEMENT'],"[""Papa John's Marketing Fund, Inc"", ""Papa John's International, Inc."", 'ABG-Shaq, LLC', 'ABG', 'PJI', 'PJMF', 'PJMF and PJI are, individually and collectively, ""PAPA JOHN\'S""']","['March 15, 2019']","['March 15, 2019']","['Unless earlier terminated in accordance with the provisions hereof, the initial term of this Agreement (""Term"") is the Effective Date through March 15, 2022.']","[""The Agreement may be extended for one (1) year upon the parties' mutual agreement in writing, it being specifically understood the services to be performed by CELEBRITY (on behalf of ABG) and remuneration to ABG in connection with the same shall be negotiated in good faith.""]",International Law,,'Civil Law',"[""Subject to the terms contained herein, PAPA JOHN'S and ABG agree and acknowledge that during the Term of this Agreement and for one (1) year thereafter, ABG shall be prohibited from granting any rights for CELEBRITY identical or similar to the rights granted to PAPA JOHN'S hereunder to any entity other than PAPA JOHN'S for the purpose of directly promoting, advertising, making an appearance on behalf of, or endorsing Competitive Products; provided, however, that in the event this Agreement is terminated pursuant to Section 7.B. of this Agreement, the prohibition referenced above shall be for a period of six (6) months, except that the prohibition shall referenced above shall not apply (or shall immediately cease to apply, as applicable) in the event of any one or more of the following: (i) the Agreement is terminated due to PAPA JOHN'S failure to pay to ABG any monies under this Agreement, as set forth herein, (ii) the Agreement is terminated due to PAPA JOHN'S failure to grant, issue, or cause to vest any of the RSUs (as hereinafter defined) under this Agreement, as set forth herein, (iii) PAPA JOHN'S failure to pay to ABG any monies under Section 7.D.a. or Section 7.D.b. of this Agreement, as set forth herein, or (iv) PAPA JOHN'S failure to grant, issue, or cause to vest any of the RSUs under Section 7.E.a. or Section 7.E.b. of this Agreement, as set forth herein.""]","['If this Agreement is terminated by ABG for any of the reasons provided in Section 7.B. above, then CELEBRITY shall be entitled to immediately vest in all of the RSUs for the eighteen (18) months following the effective date of termination (including, without limitation, any balance of unvested RSUs that were due to vest as of the effective date of termination, in addition to any and all of the RSUs that would have vested during the next eighteen (18) months but for the termination); provided, however, that in the event there is less than eighteen (18) months remaining in the Term as of the effective date of such termination, then any and all of the balance of the RSUs shall vest immediately as of the effective date of termination.', ""Upon expiration or termination of this Agreement by PAPA JOHN'S (but not in the event of termination by ABG), and subject to PAPA JOHN'S ongoing compliance with the terms and conditions of this Agreement, PAPA JOHN'S shall have the following rights to use the Celebrity Endorsement solely as follows: (i) for a period of six (6) months following the effective date of expiration or termination, PAPA JOHN'S shall have the right to continue to use, display and distribute copies of Materials which bear the Celebrity Endorsement and which were printed and published, or irrevocably booked for publication or display with a third party, prior to the effective date of expiration or termination; and (ii) PAPA JOHN'S shall have the right, without restriction, to the in-house, non-commercial use of any Materials.""]","The provided contract details mention 'International Law' as the governing law, which is not a specific law but a broad category. The contract should specify a particular civil code or legislation that will govern the agreement. Additionally, the 'Notice to terminate renewal' field is empty, suggesting either an oversight or the absence of a specific termination notice requirement for the renewal term.",[],,,PapaJohnsInternationalInc_20190617_8-K_EX-10.1_11707365_EX-10.1_Endorsement Agreement.pdf
69,Franchise,['SAMPLE OF NON-DISCLOSURE AND NON-COMPETITION AGREEMENT'],"['Member', '___________________________', 'Franchisee']","['this  _____ day of _________, 20___']",[],[],[],International Law,,,[],[],"There are several missing details in the provided contract, which may not be discrepancies but rather incomplete information. These include the lack of specificity regarding the governing international law, the absence of dates for the effective date, expiration date, and renewal term, as well as the lack of information on exclusivity, post-termination services, and notice to terminate renewal. It is recommended to fill in these details",[],,,PfHospitalityGroupInc_20150923_10-12G_EX-10.1_9266710_EX-10.1_Franchise Agreement3.pdf
