28,Co_Branding,['CO-BRANDING AND ADVERTISING AGREEMENT'],"['2THEMART.COM, INC.', '2TheMart', 'i-Escrow', 'I-ESCROW, INC.']","['June 21, 1999']","['June 21, 1999']","['The term of this Agreement shall continue for one (1) year following the Launch Date, unless earlier terminated as provided herein.']","['In the event that either party does not give such notice, the term of this Agreement shall be automatically renewed for another one (1) year.', 'A party wishing to renew this Agreement shall give the other party notice thereof no less than thirty (30) days before the expiration of the term then in effect.']",International Law,,International Law,[],"['Notwithstanding the foregoing, unless this Agreement was terminated for a material breach, all provisions of this Agreement shall survive to the extent necessary for i-Escrow to complete any Customer transactions which are pending at the time of expiration or termination.']","The 'Governing Law' is stated as 'International Law', which is quite broad and could potentially lead to confusion or disputes regarding which specific laws to apply in case of disagreements or breaches. It would be more appropriate to specify a particular country's laws or international conventions that this agreement intends to adhere to. Additionally, there appears to be a repetition in the 'Notice to Term","['In the event that either party does not give such notice, the term of this Agreement shall be automatically renewed for another one (1) year.', 'A party wishing to renew this Agreement shall give the other party notice thereof no less than thirty (30) days before the expiration of the term then in effect.']",,,2ThemartComInc_19990826_10-12G_EX-10.10_6700288_EX-10.10_Co-Branding Agreement_ Agency Agreement.pdf
29,Co_Branding,['CO-BRANDING AGREEMENT'],"['Sponsor', 'Snap Technologies, Inc.', 'United Airlines, Inc.', 'Snap']","['June 8, 1999']","['The Term shall commence on the date of this Agreement and, unless earlier terminated or extended as provided below, shall end as of December 31, 2000.']","['The Term shall commence on the date of this Agreement and, unless earlier terminated or extended as provided below, shall end as of December 31, 2000.']",[],International Law,,'International Law',"['During the Term, Snap will not grant any third party any right to sponsor any products or services in the Exclusive Category on or through the Snap Web Site.', 'For the avoidance of doubt, the parties acknowledge that the foregoing restriction applies only to persistent sponsorship placement as judged by Sponsor at its discretion, and not to run-of-site banner advertisements or other rotating promotional placements.']",[],"The 'Expiration Date' and 'Renewal Term' are identical, which might cause confusion. Also, there is no specified process for 'Notice to terminate renewal' or 'Notice to Terminate', and 'Post-Termination Services' are not defined.",[],,,EmbarkComInc_19991008_S-1A_EX-10.10_6487661_EX-10.10_Co-Branding Agreement.pdf
30,Co_Branding,['CO-BRANDING CONTENT AGREEMENT'],"['HEALTHCENTRAL.COM INC.', 'MEDIALINX INTERACTIVE, L.P.', 'MLX', 'HCI']",['30th day of June 1999'],"['The effective date of the start of the Term will be from the Launch Date.<omitted>The Parties have agreed that they will mutually approve the design of the      Co-Branded Site and that the launch date of the Co-Branded Site shall be      September 1st, 1999 unless mutually extended by the Parties as agreed to in      writing.']","['The term of this Agreement shall be for a period of two (2) years (the ""Term"").']",[],International Law,,,"['HCI shall not either directly or indirectly license or deliver content to or carry on or be engaged with any other Canadian portal web site, being a Web site which aggregates and markets a variety of content directed to multiple communities of interest and which offers products,\n\nSource: HEALTHCENTRAL COM, S-1/A, 11/8/1999\n\n\n\n\n\ntools and services to a broad base of Canadian end users.', 'During the Term of the Agreement, and subject to the following requirements respecting Canadian content levels as set out in paragraphs 3(f), (g) and (h), HCI shall be the exclusive health content partner in the health section of the Sympatico web site, provided however, that nothing contained herein shall prevent MediaLinx from entering into an agreement with other parties for: i) a health based web directory; or ii) other health related content whose content does not compete with the content contained on the Co-Branded Site; which in no event shall receive no more than one fifth (1/5th) of the promotion and which shall constitute no more than one fifth (1/5th) of the total health related content which resides on the home page of the Sympatico Health section.', 'If, at any time during the Term of this Agreement, HCI fails to meet the content requirements set out in paragraphs 3(f), (g) and (h), HCI shall no longer be entitled to be the exclusive health content partner in the health section of the Sympatico web site.']",[],,[],,,HealthcentralCom_19991108_S-1A_EX-10.27_6623292_EX-10.27_Co-Branding Agreement.pdf
31,Co_Branding,['CO-BRANDING AGREEMENT'],"['Impresse Corporation', 'VerticalNet, Inc.', 'VerticalNet', 'Impresse']","['March 3, 2000']","['March 3, 2000']",['The Term of this Agreement shall begin on the Effective Date and shall end fifteen months therefrom.'],[],International Law,,"'Civil Law' would be the most likely governing law, given that 'International Law' is a broad category and this contract is between parties from different countries. A specific civil code or country-specific law might apply here, but that information is not provided.",[],"[""During the term of this Agreement and for one year thereafter, VerticalNet shall have the right to appoint a certified public accountant to audit Impresse's financial records relating to such payment to verify the accuracy of Impresse's financial records in order to verify the amount of the payments owed and/or paid hereunder, but no more frequently than once per year.""]",,[],,,ImpresseCorp_20000322_S-1A_EX-10.11_5199234_EX-10.11_Co-Branding Agreement.pdf
32,Co_Branding,['CO-BRANDING AGREEMENT'],"['ebix.com, Inc.', 'ebix', 'About', 'About.com, Inc.']","['19th day of January, 2001']","['19th day of January, 2001']","['The term of this Agreement (the ""Term"") shall commence on the date hereof       (the ""Effective Date"") and shall expire upon delivery of [**] to ebix,       but in no way shall this Agreement extend any later than thirty (30)       months from the Effective Date regardless of the number Filled       Application Forms delivered to ebix. About will make commercially       reasonable efforts to achieve that number in twelve (12) months or less       from the Effective Date.']",[],International Law,,'International Law',"['The Insurance Center shall be hosted solely by ebix and contained in an About Wrapper and ebix shall, during the Term, provide site maintenance services relative to the Insurance Center substantially as provided for the ebix Site from time to time, subject to the uptime requirements as set forth in Section 13.4  [TERMINATION AND SURVIVAL].', 'During the Term, ebix shall be the exclusive integrated online insurance provider in the Channels and Guide Sites listed in Section 3.1  [DEVELOPMENT, OPERATION AND ADMINISTRATIO...] above. [**]']",[],"The 'Governing Law' stated is 'International Law', which is quite broad. It would be more specific and appropriate to define the exact international convention, treaty, or regulations that will govern the contract. Also, there is no clarity on the method or period of notice to terminate the agreement, which could potentially lead to discrepancies during termination.",[],,,EbixInc_20010515_10-Q_EX-10.3_4049767_EX-10.3_Co-Branding Agreement.pdf
33,Co_Branding,['CO-BRANDING AGREEMENT'],"['At Home Corporation (""Excite@Home"" or ""Excite"")', 'e-centives, Inc., (""Application Provider"" or ""e-centives"")']","['16th day of February, 2000']","['16th day of February, 2000']","['The term of this Agreement will begin on the Effective Date and will end      three (3) years from the date the Co-Branded Application becomes      accessible to Excite@Home Members (""Launch Date"").']",[],International Law,,International Law,[],"[""Upon termination of this Agreement for reasons other than a           relationship with an Excite@Home Named Competitor under Section           16.a.v., the parties will communicate with Program Members as follows:\n\n       i)   Excite@Home will email Program Members on e-centives' behalf up                to a maximum of two times. Consistent with other communications                envisioned during the Term of the Agreement, such mailings will                be branded Excite@Home but will alert Program Members that this                Agreement is to be terminated, the Co-Branded Application will<omitted>continue with e-centives branding, and Program Members will                continue as a participant in the e-centives service unless they                explicitly opt out.  The content and copy of such emails shall be                mutually agreed upon.\n\n       ii)  The first email will be exclusive to e-centives (i.e., it will                not mention similar services from Excite@Home or other third                parties) and will alert Program Members of the continuation of                the e-centives service directly from e-centives. Program Members                shall be further alerted that their membership in the e-centives                service shall continue unless they explicitly opt-out.                Excite@Home shall not promote competing services in such contact                or otherwise discourage Program Members from continuing to use                the e-centives service as provided directly by e-centives.\n\n       iii) The second email will not be exclusive to e-centives. It will                include the same e-centives alerts as in the first email, but may                offer a replacement Excite@Home service and a notification that                the Program Member will remain in such an Excite@Home-provided                service unless they specifically opt-out. Excite@Home shall not                discourage Program Members from continuing to use the e-centives                service directly from e-centives, but may offer an additional                choice. It is conceivable that any one end user customer could                use both services.\n\n       iv)  Any such communications will be subject to Excite@Home's                then-current privacy policy."", ""Effects of Termination<omitted>iii) For a period of up to sixty (60) days, Application Provider will           provide consulting services to Excite@Home, as Excite@Home may           reasonably request and for reasonable fees to be paid to Application           Provider, such fees to be agreed upon in writing by the Parties, to           assist Excite@Home in providing a seamless transition to Program           Members. Application Provider will have no obligation to provide such           services to Excite@Home to the extent that Application Provider's           personnel and resources are unavailable in the amounts requested by           Excite@Home or if the Parties are unable in good faith to agree on the           reasonable fees to be paid to Application Provider for such services.           Application Provider will not be required, in the course of providing           such consulting services to Excite@Home, to disclose or transfer to           Excite@Home any proprietary information, software, or Intellectual           Property of Application Provider or any of its merchant partners."", 'To further ensure a seamless transition for Program Members, in the           event of a termination based upon a material breach by e-centives or           an acquisition pursuant to Section 16.a.v. only, Application Provider           shall continue to host and maintain the Co-Branded Application for a           period of one hundred twenty (120) days following either receipt or           issuance of notice of intention to terminate this Agreement. Such           hosting and maintenance of the Co-Branded Application shall be           provided by Application Provider at such reasonable rates as are           mutually agreed upon by the parties.']",There are a few discrepancies in the provided details.,[],,,InvendaCorp_20000828_S-1A_EX-10.2_2588206_EX-10.2_Co-Branding Agreement.pdf
34,Co_Branding,['CO-BRANDING AGREEMENT'],"['Lucent Technologies Inc.', 'Lucent', 'mPhase Technologies Inc.', '(each individually, ""a Party"" and, collectively, ""the Parties""}.', 'mPhase']",['21st day of January 2003'],[],"['The Term of this Agreement will commence on the date above, and shall          continue for a term of one (1) year']","['mPhase shall have the right to          annually renew this agreement for a period of one year upon each annual          expiration with the written consent of Lucent, which written consent          shall not be unreasonably withheld.']",International Law,,International Law,[],[],,[],,,MphaseTechnologiesInc_20030911_10-K_EX-10.15_1560667_EX-10.15_Co-Branding Agreement.pdf
35,Co_Branding,['CO-BRANDING AGREEMENT'],"['VerticalNet', 'LeadersOnline', 'VerticalNet, Inc.', '(each a ""Party"" and together the ""Parties"").', 'LeadersOnline, Inc.']","['March 15, 2000']","['March 15, 2000']","['Term shall mean the Effective Date through June 15, 2001 and any Renewal Term (as defined in paragraph 7.4 herein.)']","['LeadersOnline shall have the option, subject to VerticalNet\'s approval exercised in its sole  and absolute discretion, to extend the Term of this Agreement for an additional 12 months (a ""Renewal Term"") on such terms and conditions as may be mutually agreed upon by the Parties.']",International Law,,"'Civil Law' would be the most applicable governing law in this case, since 'International Law' is a broad term and there are no specific mentions of any country-specific commercial codes or contract acts. 'Civil Law' is a general term used to describe a legal system that comprises of codified laws.",[],[],,[],,,LeadersonlineInc_20000427_S-1A_EX-10.8_4991089_EX-10.8_Co-Branding Agreement.pdf
36,Co_Branding,['CO-BRANDING AGREEMENT'],"['VerticalNet, Inc.', 'VerticalNet', 'Neoforma', 'Neoforma.com, Inc.']","['November 19, 1999']","['November 19, 1999']","['INITIAL TERM shall mean the Effective Date through the day prior to the second anniversary of the Effective Date, unless earlier terminated pursuant to Section 11.']","['This Agreement will automatically renew at the end of the Initial Term or a subsequent renewal term on a year to year basis (each, a ""Renewal Term""), unless either Party notifies the other at least 30 days prior to the end of the Initial Term or then current Renewal Term, as applicable, of its intention not to renew this Agreement (a ""Termination Notice"").']",International Law,,"'Civil Law'  (as the governing law specified is International Law, and this encompasses various civil codes)","['Within 30 days after the Effective Date, Neoforma shall provide a copy of all Neoforma Laboratory Product Listings existing as of the Effective Date to VerticalNet for use on the VerticalNet Sites on an exclusive basis (even as to Neoforma), to the extent Neoforma has the right to do so.', 'Within 30 days after the Effective Date, VerticalNet shall provide a copy of all VerticalNet Medical Product Listings for New Medical Products existing as of the Effective Date to Neoforma for use on Neoforma Plan, Neoforma Shop and Neoforma Auction on an exclusive basis (even as to VerticalNet), to the extent VerticalNet has the right to do so.', 'Neoforma hereby grants VerticalNet an exclusive license to use, modify, enhance, reproduce, display, perform and transmit the Neoforma Career Content, subject to and in accordance with the terms, conditions and provisions of this Agreement.', 'Neoforma hereby grants VerticalNet an exclusive license, even as to Neoforma, to use, modify, enhance, reproduce, display, perform and transmit the Neoforma Laboratory Product Listings, subject to and in accordance with the terms, conditions and provisions of this Agreement, to the extent Neoforma has the right to do so.', 'Neoforma shall not place any Link on a Neoforma Site to, or a Neoforma Link on the Site of, any other provider or host of a service similar to the Co-Branded Training and Education Center or to any other training or education service websites.', 'From time to time during the Term, VerticalNet shall provide a copy of all VerticalNet Medical Product Listings received by VerticalNet after the Effective Date to Neoforma as such Product Listings are made available to VerticalNet for use on Neoforma Plan, Neoforma Shop and Neoforma Auction on an exclusive basis (even as to VerticalNet), to the extent VerticalNet has the right to do so.', 'During the Term, VerticalNet shall have the exclusive right to arrange for the sale of all advertising on the Co-Branded Sites, subject to reasonable approval of each such advertiser by Neoforma.', 'VerticalNet hereby grants Neoforma an exclusive license, even as to<omitted>VerticalNet, to use, modify, enhance, reproduce, display, perform and transmit the VerticalNet Medical Product Listings, subject to and in accordance with the terms, conditions and provisions of this Agreement, to the extent that VerticalNet has the right to do so.', 'Within 30 days after the Effective Date, VerticalNet shall provide a copy of all VerticalNet Medical Product Listings for Used and Excess Medical Products existing as of the Effective Date to Neoforma for use on Neoforma Plan, Neoforma Shop and Neoforma Auction on an exclusive basis (even as to VerticalNet), to the extent VerticalNet has the right to do so.', 'Neoforma hereby grants VerticalNet an exclusive license to use, modify, enhance, reproduce, display, perform and transmit the Neoforma T&E Content, subject to and in accordance with the terms, conditions and provisions of this Agreement.', 'Notwithstanding the foregoing, VerticalNet\'s activities in connection with its ""Storefronts"" and ""E-Commerce Centers"" (as conducted today, in a fashion substantially similar to the manner in which such activities are conducted today or as otherwise mutually agreed upon by the parties, which agreement shall not be unreasonably withheld or delayed) shall not be considered to be a breach of Section 2.1  [MEDICAL PRODUCTS], 2.2  [MEDICAL PRODUCTS] or 2.3  [MEDICAL PRODUCTS].']","['If a Termination Notice is sent, the parties shall promptly meet to discuss a phase-out of the Co-Branded Sites and all Links and transfers of Product Listings set forth herein.']",,"['This Agreement will automatically renew at the end of the Initial Term or a subsequent renewal term on a year to year basis (each, a ""Renewal Term""), unless either Party notifies the other at least 30 days prior to the end of the Initial Term or then current Renewal Term, as applicable, of its intention not to renew this Agreement (a ""Termination Notice"").']",,,NeoformaInc_19991202_S-1A_EX-10.26_5224521_EX-10.26_Co-Branding Agreement.pdf
37,Co_Branding,['CO-BRANDING AGREEMENT'],"['PaperExchange', 'PaperExchange.com, LLC', 'VerticalNet, Inc.', 'VerticalNet']",[],"['September 30, 1999']","['Initial Term shall mean the Effective Date through the day prior to the fourth anniversary of the Effective Date, unless earlier terminated pursuant to Section 8']","['This Agreement will automatically renew at the end of the Initial Term or a subsequent renewal term on a year to year basis (each, a ""Renewal Term""), unless either party notifies the other at least 30 days prior to the end of the Initial Term or then current Renewal Term, as applicable, of its intention not to renew this Agreement.']",International Law,,'Civil Law' (as 'International Law' is too broad and this contract contains elements of a civil nature),"['PaperExchange shall retain the right to place advertisements for its own account on the remaining ***** of the Third Party Advertising Allocation; provided, however, that if any portion of such Third Party Advertising Allocation remains unsold 45 days after it becomes available for advertising, VerticalNet shall have the exclusive right to arrange for third party advertising on such unsold Third Party Advertising Allocation.', 'During the Term, VerticalNet shall have the exclusive right to arrange for the sale of ***** of the third party advertising inventory (which shall consist of a minimum of one advertisement per page on each of the ""Co-Branded Equipment,"" ""Co-Branded Careers,"" ""Resources"" and ""Home Page"" sections or successor, replacement or substitute sections) of the PaperExchange Site and shall be consistent with the amount of advertising on other business to business vertical sites on the PaperExchange Site (the ""Third Party Advertising Allocation"").', 'PaperExchange hereby grants VerticalNet an exclusive license to use, modify, enhance, reproduce, display, perform and transmit the PaperExchange Content, subject to and in accordance with the terms, conditions and provisions of this Agreement.']","[""Upon termination of this Agreement,<omitted>(b) VerticalNet shall be responsible for all charges, payments or expenses incurred by it in connection with the removal of the PaperExchange Links from Co-Branded Sites and the modification of the Co-Branded Sites, including, but not limited to, the removal of PaperExchange Content; (c) PaperExchange shall be responsible for all charges, payments or expenses incurred by it in connection with the removal of the VerticalNet Links, VerticalNet Content and VerticalNet Archived Content from the PaperExchange Site;<omitted>(i) VerticalNet shall retain ownership of the URLs at which the Co-Branded Sites are located, (I) the Co-Branded URLs shall be owned by the party that offers to pay the highest amount to the other for the ownership of such URLs upon payment of such amount to the other party (k) if the agreement is terminated during the Initial Term by VerticalNet pursuant to Section 8.2  [Termination for Cause], (x) VerticalNet shall be released from its obligations under Section 5.8.1  [Non-Competition] and (y) PaperExchange's obligations under Sections 7.2  [Advertising Revenue] and 7.4  [Revenue Sharing] shall be extended for one year after the date of such termination, and (I) if the agreement is terminated during the Initial Term by PaperExchange pursuant to Section 8.2  [Termination for Cause], VerticalNet shall pay to PaperExchange, as liquidated damages, an amount equal to the product determined by multiplying (1) a fraction, the numerator of which shall be the number of days between the effective date of termination and the scheduled expiration date of the Initial Term, and the denominator of which shall be the number of days<omitted>between the Effective Date and the scheduled expiration date of the Initial Term, by (2) *****""]","There is no explicit 'Agreement Date' specified in the details provided, which could potentially cause issues in interpreting and applying the contract. Also, certain critical financial details are omitted in the 'Post-Termination Services' section, such as the rate or formula for calculating the amount VerticalNet","['This Agreement will automatically renew at the end of the Initial Term or a subsequent renewal term on a year to year basis (each, a ""Renewal Term""), unless either party notifies the other at least 30 days prior to the end of the Initial Term or then current Renewal Term, as applicable, of its intention not to renew this Agreement.']",,,PaperexchangeComInc_20000322_S-1A_EX-10.4_5202103_EX-10.4_Co-Branding Agreement.pdf
38,Co_Branding,['CO-BRANDING AGREEMENT                                      (FORM)'],"['NETTAXI', '""SpinRecords.com""  or  ""Client""', 'Solutions  Media,  Inc.,  dba SpinRecords.com', 'NETTAXI Online Communities, Inc.']","['Nov  5,  1999']","['Nov  5,  1999']","['This  Agreement  shall  be effective upon the              ------------------- Effective Date and shall remain in force for a period of one (1) year, and shall be automatically renewed for successive periods of one (1) year unless otherwise terminated  as provided  herein.']","['This  Agreement  shall  be effective upon the<omitted>Effective Date and shall remain in force for a period of one (1) year, and shall be automatically renewed for successive periods of one (1) year unless otherwise terminated  as provided  herein.']",International Law,,International Law,[],[],"There are a few discrepancies in the provided details. First, the 'Notice to terminate renewal' and 'Post-Termination Services' sections are marked as 'nan' (not a number), which suggests that these details might be missing or incomplete. Additionally, the 'Exclusivity' section is empty, which may indicate an oversight or the non-exclusivity nature of the agreement",[],,,RaeSystemsInc_20001114_10-Q_EX-10.57_2631790_EX-10.57_Co-Branding Agreement.pdf
