,Category,Document Name,Parties,Agreement Date,Effective Date,Expiration Date,Renewal Term,Governing Law,Notice to terminate renewal,Exact_Law,Exclusivity,Post-Termination Services,Discrepancy,Notice to Terminate Renewal,Unnamed: 14,Unnamed: 15,Filename
0,Co_Branding,['CO-BRANDING AND SERVICES AGREEMENT'],"['PrimeCall', 'deltathree.com, Inc. (formerly known as Delta Three, Inc.)', 'RSL COM PrimeCall, Inc.', 'DeltaThree']","['October 1, 1999']","['October 1, 1999']","['The term of this Agreement shall be effective as of the date first stated above and shall continue for a term of three (3) years, unless terminated earlier in accordance with the provisions of this Agreement (the ""Term""); provided, however, that PrimeCall may elect to terminate this Agreement, upon thirty (30) days\' written notice, at any time from and after the time that collectively RSL Communications, Ltd. and/or its Affiliates holds less than fifty percent (50%) of the voting control of DeltaThree\'s outstanding shares.']",[],Indian Law,,,[],[],,[],,,DeltathreeInc_19991102_S-1A_EX-10.19_6227850_EX-10.19_Co-Branding Agreement_ Service Agreement.pdf
1,Co_Branding,['CO-BRANDING AGREEMENT'],"['Women.com', 'eDiets', 'WOMEN.COM NETWORKS, INC.', 'EDIETS.COM, INC.']","['May 22, 2000']","['May 22, 2000']","['This Agreement will become effective as of the Effective Date and, unless sooner terminated pursuant to Sections 3.1<omitted>, shall remain effective for two (2) years from and after the Effective Date (the ""Initial Term"").']","['This agreement shall automatically renew for additional successive terms of twelve (12) months each at the end of the Initial Term (""Renewal Terms""), unless either party notifies the other in writing at least sixty (60) days prior to the end of the Initial Term.']",Indian Law,,Civil Law,"['During the Term, eDiets will not buy, sell, display or distribute advertising from (including, but not limited to, banner ads, buttons, badges, text links, hyperlinks or editorial mentions) or otherwise promote any Women.com Compettive Company on any page of the eDiets Site that is within two clicks from the Gateway Page of the Diet Center.', 'For purposes of this Agreement, ""Competitive Company"" means any company that eDiets reasonably presents as, and Women.com reasonably agrees is, a direct competitor to eDiets by distributing on-line content principally relating to diets and diet counseling, including, but not limited to, Weight Watchers, Jenny Craig, NutriSystem, Nutrio, Asimba, DietSmart and uMagic.', 'For purposes of this Agreement, ""Women.com Competitive Company"" means any company that Women.com reasonably presents as, and eDiets reasonably agrees is, a direct competitor to Women.com by providing an on-line portal for women, including, but not limited to, Oxygen Media and iVillage,', 'Notwithstanding the foregoing, Women.com shall be entitled to (aa) provide mini and micro web sites and Women.com promotions and sponsorships to Jenny Craig; (bb) sell, display, or distribute advertisements, including banner advertisements, newsletter placements, internet radio, commerce placements and market research, or otherwise promote Competitive Companies on pages other than the Gateway Page of the Diet Center.', 'During the Term,<omitted>(b) eDiets will be the exclusive third party provider of content and interactive tools for diets and diet counseling to Women.com within the Diet Center;']",[],"There is a discrepancy regarding the governing law mentioned in the contract. The parties have stated that Indian Law will govern the agreement, however, the provided details show a Co-Branding Agreement between companies based in the United States. It is unlikely that Indian Law would apply to this agreement.","['This agreement shall automatically renew for additional successive terms of twelve (12) months each at the end of the Initial Term (""Renewal Terms""), unless either party notifies the other in writing at least sixty (60) days prior to the end of the Initial Term.']",,,EdietsComInc_20001030_10QSB_EX-10.4_2606646_EX-10.4_Co-Branding Agreement.pdf
2,Co_Branding,['PRODUCT DEVELOPMENT AND CO-BRANDING AGREEMENT'],"['d/b/a Time Life Music', 'Integrity', 'TL', 'TIME LIFE, INC.', 'INTEGRITY INCORPORATED']",['10th day of January 2000'],[],"['This agreement shall commence as of date first above written, and          shall Continue through December 31, 2004 (""the Term"").']",[],Indian Law,,"Civil Law (as 'Contract Act' and 'Commercial Code' are specific to certain jurisdictions, and 'Consumer Protection Act' is not the primary governing law in this case)","['Integrity will hold exclusive                   worldwide rights to promote and sell the product to/through                   the following distribution channels: Christian retail (CBA or                   Christian Booksellers Association markets), direct mail                   (including continuity sales, church sales, digital and                   e-commerce sales.)', 'TL will hold exclusive worldwide                   rights to promote and sell the product through the following                   distribution channels: Outgoing telemarketing, General Market                   retail, and General Market catalogs, and exclusive rights                   within the United States for Television Direct response.']",[],,[],,,IntegrityMediaInc_20010329_10-K405_EX-10.17_2373875_EX-10.17_Co-Branding Agreement.pdf
3,Co_Branding,['ENDORSEMENT LICENSING AND CO-BRANDING AGREEMENT'],"['Endorser', 'collectively, Lender, Endorser, and Fitness are referred to as the ""AS Parties""', 'MusclePharm Corporation', 'Lender', 'Marine MP, LLC', 'Arnold Schwarzenegger', 'Fitness', 'collectively, ""MusclePharm"" or the ""Company""', 'Fitness Publications, Inc.']","['July 26, 2013']","['July 26, 2013']","['The Term shall commence on July 23, 2013 and shall expire on July 22, 2016, unless otherwise terminated earlier pursuant to Section 9 of this Agreement.', 'This Agreement shall have an Initial Term of three (3) years.']","['If this Agreement is renewed for the Second Additional Term, then the Second Additional Term shall commence on July 23, 2019 and the Agreement shall expire and terminate automatically without further notice on July 22, 2022.', 'In the event that MusclePharm shall achieve Net Sales (as defined below) of $20 million (the ""First Renewal Threshold"") in the aggregate during the Third Contract Year, then this Agreement shall automatically be renewed for an additional term of three (3) years (the ""First Additional Term"") on the same terms and conditions for the Initial Term except that: (i) no additional Stock Compensation (as defined below) shall be issued in connection with the renewal Term, (ii) the Cash Compensation for the First Additional Term shall be as set forth in Section 7 and Exhibit ""C"" Section (2) attached hereto, (iii) Endorser shall only be obligated to make two (2) Appearances in each Contract Year during the First Additional Term pursuant to Section 4(a)(ii) below and (iv) the marketing budget to promote the Licensed Products shall be $5.0 million during each Contract Year of the First Additional Term (subject to Section 12(b) of this Agreement).', 'If this Agreement is renewed for the First Additional Term, then the First Additional Term shall commence on July 23, 2016, and the Agreement shall expire and terminate automatically without further notice on July 22, 2019.', 'In the event that MusclePharm shall achieve Net Sales of $50 million (the ""Second Renewal Threshold"") in the aggregate during the sixth Contract Year, then this Agreement shall automatically be renewed for an additional term of three (3) years (the ""Second Additional Term"") on the same terms and conditions for the initial Term except that: (i) no additional Stock Compensation (as defined below) shall be issued in connection with the renewal Term, (ii) the Cash Compensation for the renewal Term shall be as set forth in Section 7 and Exhibit ""C"" Section (3) attached hereto, (iii) Endorser shall only be obligated to make two (2) Appearances in each Contract Year during the Second Additional Term pursuant to Section 4(a)(ii) below and (iv) the marketing budget to promote the Licensed Products shall be $5.0 in each Contract Year of the Second Additional Term (subject to Section 12(b) of this Agreement).']",Indian Law,,"Civil Law' (based on the mention of Indian Law as the governing law, but it's not specifically mentioned if it's the Contract Act, Commercial Code, or Consumer Protection Act)","[""During the term of this Agreement, or any extensions of this Agreement, Endorser and the Lender hereby agree and warrant that it will not enter into any other endorsement agreement for the use of Endorser's name, image and/or likeness for advertising, marketing and/or endorsement of any other dietary supplements during the Term of this Agreemen""]","['Notwithstanding the foregoing, in the event the expiration of this Agreement or termination of this Agreement by Musclepharm pursuant to paragraph 9(a), MusclePharm shall be entitled to sell-off the remaining Licensed Products for six (6) months after such expiration of this Agreement pursuant to paragraph 4(d) herein and shall continue to pay Endorser the Royalty set forth in paragraph 7 herein.', ""MusclePharm's obligations for the payment of a Royalty and the Guaranteed Minimum Royalty (as defined below) shall survive expiration or termination of this Agreement and will continue for so long as MusclePharm continues to manufacture, sell or otherwise market the Licensed Products."", 'During the Term, the right to use Endorser\'s Name and Appearance Rights granted to MusclePharm in this Section shall extend for six (6) months beyond the expiration of this Agreement (the ""Use-up Period"").', 'During the Term of this Agreement and during any sell-off period, MusclePharm shall pay Lender a royalty (the ""Royalty"") of 10% on Net Sales (as defined below) of Licensed Products sold through its wholesale Distribution Channels or retail Distribution Channels, as the case may be and 10% on Net Sales of the Training Video and any Products sold in connection with any Training Video as contemplated pursuant to the last sentence of Section 4(a)(i) above.', ""MusclePharm shall create no new advertising during the Use-up Period using Endorser's Name and Appearance, but shall have the right to use during the Use-up Period Endorser's Name and Appearance in advertisements and promotional materials created before the expiration date of this Agreement."", 'MusclePharm agrees to preserve and keep accessible and available to the AS Parties all relevant books and records for a period of at least three (3) years following the expiration or termination of the Agreement.']",,[],,,MusclepharmCorp_20170208_10-KA_EX-10.38_9893581_EX-10.38_Co-Branding Agreement.pdf
4,Co_Branding,['CO-BRANDING AGREEMENT'],"['Skype, Online BVI and the Company may be referred to individually as ""Party"" and collectively as ""Parties."" Skype, Online BVI, the Company, Skype Holding and Tom Holding may be referred to individually as ""party to this Agreement"" and collectively as ""parties to this Agreement.""', 'Skype', 'Tel-Online Limited', 'Online BVI', 'Skype Technologies, S.A.', 'TOM Online (BVI) Limited', 'Skype Communications, S.A.', 'Tom Holding', 'Company', 'TOM Online Inc.', 'Skype Holding']",['22nd day of August 2005'],['22nd day of August 2005'],"['The term of this Agreement shall continue for a period of five years following the initial date of execution of the Memorandum, unless terminated earlier pursuant to Section 6.2 or Section 2.8 (""Initial Term"").']","['This Agreement shall automatically continue following the Initial Term, for an additional period of three (3) years, unless a party to this Agreement provides written notice of termination to the other parties at least sixty (60) days prior to the expiration of the Initial Term or this Agreement (""Extended Term"" and, with the Initial Term, ""Term"").']",Indian Law,,,[],"['The Parties (including Online BVI on behalf of the Online Group) agree to maintain records (i) of all information reasonably necessary to verify all calculations to be made under Section 8.3.2, and (ii) supporting, verifying and necessary to demonstrate the calculation and collection of fees and/or revenue, as well as any deductions thereto, and payments made hereunder, including, without limitation, budgets, purchase orders, expense records, invoices, correspondence, banking and financial and other records pertaining to the determination of Gross Revenue, Direct Expenses and Adjusted Net Revenue, during the term of this Agreement and for a period of two (2) years following the expiration or termination hereof.', 'Each Party shall (i) immediately stop displaying, featuring, linking or in any other manner using the Company-Skype Branded Application (provided in the case of Skype, other than the Skype Software in the Company-Skype Branded Application), Company-Skype Toolbar, Company-Skype Branded Web Site, Company-Skype Branded Content, any co-branded materials or any other Intellectual Property of the other Parties (including, without limitation, Intellectual Property deemed to be owned by the other Parties under Section 4.2.3.2); (ii) return such materials directly to the other Parties, or delete and overwrite any electronically stored copies of such materials within thirty (30) days from the date of termination of this Agreement; (iii) within such thirty (30) day period, deliver to the other Parties a certificate duly executed by its authorised officer certifying its compliance with the foregoing, and (iv) provide the other Parties with such information and access to data and databases as may be necessary to permit such other Parties to fulfil any contractual obligations by them to users of the Company-Skype Branded Application undertaken by such other Parties prior to the time of termination.', 'The Parties agree that notwithstanding any termination or expiration of this Agreement, the rights and licenses granted to any Company- Skype Branded Customers prior to termination or expiration of this Agreement pursuant to any EULA shall continue during the 24 months after such termination or expiration for the sole purpose of permitting such users to continue to access and utilize the Company-Skype Branded Application and the Company-Skype Toolbar, and so long as any Gross Revenue is received with respect to the Company-Skype Branded Application and/or the Company-Skype Toolbar, the provisions of Section 5 shall continue to be applicable after any termination or expiration.']",,"['This Agreement shall automatically continue following the Initial Term, for an additional period of three (3) years, unless a party to this Agreement provides written notice of termination to the other parties at least sixty (60) days prior to the expiration of the Initial Term or this Agreement (""Extended Term"" and, with the Initial Term, ""Term"").']",,,TomOnlineInc_20060501_20-F_EX-4.46_749700_EX-4.46_Co-Branding Agreement.pdf
5,Development,['DEVELOPMENT AGREEMENT'],"['also known as Stryker Orthopaedics   (""Stryker"")', 'Conformis', 'Howmedica Osteonics Corp.', 'Conformis, Inc.', 'Stryker and Conformis are collectively referred to herein as the ""Parties"" and   individually as a ""Party.""']","['September 30, 2019']","['September 30, 2019']","['The term of this Agreement shall begin as of the Effective Date and continue until Acceptance of all Deliverables   for Milestones #1 and #2 pursuant to Section 3.4 and completion of Milestone #3, unless earlier terminated under Section 8.2, as   provided for under the Other Agreements, or as mutually agreed by the Parties.']",[],Indian Law,,,"['Except as specifically provided in the Distribution Agreement, Conformis shall be prohibited from   developing or assisting another in developing, or causing another to develop, Patient-Specific Instrumentation for Off-The-Shelf   Knee Implants for any Third Party in the field of orthopedics until January 1, 2032 (or earlier, to the extent set forth in Section   2.3.3.4 or Section 2.3.5 of the Distribution Agreement), with the exception that Conformis (including any entity involved in a   Change of Control of Conformis, any such entity an ""Acquirer""), may develop Patient-Specific Instrumentation for any Off-The-   Shelf Implants of Conformis, an Acquirer or any of their Affiliates.']",[],None (all the provided details seem to be coherent and there are no apparent contradictions or inconsistencies),[],,,ConformisInc_20191101_10-Q_EX-10.6_11861402_EX-10.6_Development Agreement.pdf
6,Development,['EXCLUSIVE LICENSE AND PRODUCT DEVELOPMENT AGREEMENT'],"['Aucta Pharmaceuticals, Inc.', 'Eton Pharmaceuticals, Inc.', 'Aucta', 'ETON']","['June 12, 2019']","['The term of this Agreement shall automatically become effective upon the occurrence of (i) ETON executing a commercial supply agreement with a contract manufacturing organization within forty-five (45) days of the Execution Date, provided that ETON has exercised best efforts to execute such agreement and the failure to execute is solely caused by the refusal or inability of the proposed manufacturing organization to sign a reasonable agreement; and (ii) acceptance for review of the Dossier or marketing application for [ * * * ] by the FDA no later than September 2, 2019 (such date, the ""Effective Date"") and shall end upon the termination or expiration of the Agreement as set forth in Section 11 (the ""Term"").']","['The term of this Agreement shall automatically become effective upon the occurrence of (i) ETON executing a commercial supply agreement with a contract manufacturing organization within forty-five (45) days of the Execution Date, provided that ETON has exercised best efforts to execute such agreement and the failure to execute is solely caused by the refusal or inability of the proposed manufacturing organization to sign a reasonable agreement; and (ii) acceptance for review of the Dossier or marketing application for [ * * * ] by the FDA no later than September 2, 2019 (such date, the ""Effective Date"") and shall end upon the termination or expiration of the Agreement as set forth in Section 11 (the ""Term"").']",[],Indian Law,,'Civil Law' (given that Indian Law is specified and this is a general governing law for contracts in India),"['Aucta, for itself and its Affiliates, hereby grants to ETON in accordance with the terms and conditions of this Agreement, an exclusive (even as to and against Aucta in the Territory) right and license, including the right to sublicense, to the Products (or any components thereof), Dossiers, and all current and future Aucta Background Intellectual Property that is owned or controlled by Aucta or its Affiliates for ETON to develop, manufacture, import, use, promote, distribute, market, advertise, offer for sale or sell (collectively, ""Market"") the Products in and for the Territory.']","['In addition, within twenty-five (25) months after the termination or expiration of the Term and on a Product-by-Product basis, ETON shall perform a final ""true-up"" reconciliation and shall provide Aucta with a written report of such outlining the deductions specified in the definition of Net Sales.', ""After termination is effective and Aucta assumes control of the Product, ETON will provide, to the extent practicable, transition services to Aucta to include assistance with Product distribution, processing of rebates, drug safety, etc. at Aucta's cost for such services, for a reasonable period of time as mutually determined by the Parties but not to exceed one hundred eighty (180) days following termination so that Aucta can get its own such services in place."", ""If this Agreement is terminated by Aucta under Section 11.2 or 11.3, then (a) ETON shall have the right to, and Aucta shall hereby grant ETON a license to, Market or otherwise dispose of any existing inventory of any Products then in ETON's possession subject to paying all Royalties and other amounts due hereunder for such sales, (b) Aucta may keep all the payments under Section 6 paid by ETON up to the point of termination and for ETON's disposal of remaining inventory and Aucta is free to commercialize or relicense the Product with no further obligations owed to ETON, (c) ETON shall refrain from holding itself out as Aucta's distributor, in particular, eliminate any reference to the Product and Aucta from its business, trade style and promotional material, and (d) ETON shall transfer all rights, licenses within thirty (30) days of termination.""]",,[],,,EtonPharmaceuticalsInc_20191114_10-Q_EX-10.1_11893941_EX-10.1_Development Agreement.pdf
7,Development,['JOINT DEVELOPMENT AGREEMENT'],"['FuelCell Energy, Inc.', 'FCE', 'ExxonMobil', 'ExxonMobil Research and Engineering Company']","['November 5, 2019']","['""Effective Date"" means October 31, 2019.']","['Unless sooner terminated in accordance with this Article, this Agreement will continue in full force beginning on the Effective Date and ending two (2) years thereafter (""Term"").']",[],Indian Law,,Civil Law,[],"['Such books, records and accounts will be maintained for a period of at least three (3) years following the termination or expiration of this Agreement, provided there are no pending disputes between the Parties.']","There is no major discrepancy in the provided details. However, it is noted that there is no mention of a renewal term in this agreement. Also, the notice period for termination is not explicitly stated. Furthermore, it is uncommon for an agreement governed by Indian Law to be entered between two U.S. based parties, 'FuelCell Energy, Inc.' and 'ExxonMobil Research and Engineering",[],,,FuelcellEnergyInc_20191106_8-K_EX-10.1_11868007_EX-10.1_Development Agreement.pdf
8,Development,['RECIPE DEVELOPMENT AGREEMENT'],"['B C Marketing Concepts Inc., dba Full Sail Brewing Company', ""Reed's"", ""Reed's, Inc."", 'Company']","['October 11, 2019']","['October 11, 2019']","['The term of this Agreement shall commence on the Effective Date and shall continue for the longer of the first anniversary of the Effective Date or the duration of the Manufacturing and Distribution Agreement (the ""Term"").']",[],Indian Law,,,"['In exchange for Company\'s contributions and obligations under this Agreement, Reed\'s grants Company the exclusive right to manufacture, package, promote, sell and distribute the Products (if and to the extent approved by the Development Committee), subject to the terms and conditions of a separate Manufacturing and Distribution Agreement to be entered into by the parties concurrently with this Agreement, as it may be amended, modified, supplemented or restated from time to time (the ""Manufacturing and Distribution Agreement"").']",[],,[],,,ReedsInc_20191113_10-Q_EX-10.4_11888303_EX-10.4_Development Agreement.pdf
9,Endorsement,['ENDORSEMENT AGREEMENT ADDENDUM I'],"['(""NFLA"")', 'Gridiron BioNutrients™', '(""NFLA-NC"")', 'National Football League Alumni, Inc', 'National Football League Alumni - Northern California Chapter', 'Food For Athletes, Inc', '(collectively the ""Company"").']","['November 7, 2017']","['November 7, 2017']",[],[],Indian Law,,"Civil Law (as 'Indian Law' is a broad term that could include various acts and codes, 'Civil Law' is a general categorization)",[],[],,[],,,GridironBionutrientsInc_20171206_8-K_EX-10.2_10972556_EX-10.2_Endorsement Agreement.pdf
10,Endorsement,['ENDORSEMENT AGREEMENT'],"['Eco Science Solutions, Inc.', 'Stephen Marley', 'Talent', 'ESSI']",['14th day of November 2017'],['14th day of November 2017'],"['The term of this Agreement shall be for one (1) year commencing on the Effective Date and automatically renewing annually thereafter, unless either party provides a thirty-day notice of written termination one to the other (""Term"").']","['The term of this Agreement shall be for one (1) year commencing on the Effective Date and automatically renewing annually thereafter, unless either party provides a thirty-day notice of written termination one to the other (""Term"").']",Indian Law,,"'Civil Law' (since Indian Law is a broad term that covers various specific laws, and in the absence of more specific information, I am assuming 'Civil Law' to be the applicable governing law)",[],[],,"['The term of this Agreement shall be for one (1) year commencing on the Effective Date and automatically renewing annually thereafter, unless either party provides a thirty-day notice of written termination one to the other (""Term"").']",,,EcoScienceSolutionsInc_20171117_8-K_EX-10.1_10956472_EX-10.1_Endorsement Agreement.pdf
